<?xml version="1.0" encoding="UTF-8"?>
<!DOCTYPE Produktkatalog SYSTEM "Aufgabe2.1.dtd">
<Produktkatalog>
	<Header>
		<Generierungsdatum>21.10.2014</Generierungsdatum>
		<Name>Katalog</Name>
	</Header>
	<Artikel ArtikelNr="ID1">
		<Kurzbeschreibung>Artikel1</Kurzbeschreibung>
		<Hersteller>Hersteller1</Hersteller>
		<zusatz_ArtikelNr>11111</zusatz_ArtikelNr>
		<Langbeschreibung>das ist der erste Arikel</Langbeschreibung>
		<Preis>
			<Netto>
				<DerPreis>10000</DerPreis>
				<Kürzel Währung="CHF"/>
				<LandesKürzel>"CH"</LandesKürzel>
				<Steuersatz>"12"</Steuersatz>
			</Netto>
		</Preis>
	</Artikel>
	<Artikel ArtikelNr="ID2">
		<Kurzbeschreibung>Artikel2</Kurzbeschreibung>
		<Hersteller>Hersteller2</Hersteller>
		<zusatz_ArtikelNr>2222</zusatz_ArtikelNr>
		<Langbeschreibung>das ist der zweite Arikel</Langbeschreibung>
		<Preis>
			<Brutto>
				<DerPreis>20000</DerPreis>
				<Kürzel Währung="EUR"/>
				<LandesKürzel>"D"</LandesKürzel>
				<Steuersatz>"19"</Steuersatz>
			</Brutto>
		</Preis>
	</Artikel>
	<Artikel ArtikelNr="ID3">
		<Kurzbeschreibung>Artikel3</Kurzbeschreibung>
		<Hersteller>Hersteller3</Hersteller>
		<zusatz_ArtikelNr>3333</zusatz_ArtikelNr>
		<Langbeschreibung>das ist der dritte Arikel</Langbeschreibung>
		<Preis>
			<Brutto>
				<DerPreis>30000</DerPreis>
				<Kürzel Währung="GBP"/>
				<LandesKürzel>"GB"</LandesKürzel>
				<Steuersatz>"0"</Steuersatz>
			</Brutto>
		</Preis>
	</Artikel>
</Produktkatalog>
